outros	LEI SECA - Novos veículos e bafômetros reforçam operações do Detran em Rondônia: As operações Lei Seca e Ca... http://t.co/SapAV0OAvx
outros	Começando mais uma semana estágio (@ Ponto1 Veículos (Chevrolet) - @ponto1veiculos in Florianópolis, SC) https://t.co/MPx7gVJNKQ
outros	RT @transitoagoraSP: Rodízio em operação para veículos com placa final 3 e 4, das 07:00 até 10:00. #TransitoSP
outros	No setor de veículos, os dados da FEE apontam o aumento de US$ 42,3 milhões nas exportações de automóveis, caminhonetas e utilitários.
outros	Chegando agora do Evento da Federação Paulista de Futebol. Antes, estava no grande evento realizado pela Under Armour. Vendas são ótimas.
outros	Começou as vendas!! Garanta já o seu ingresso comigo!! LOTE PROMOCIONAL 04 à 09/05   Whats: https://t.co/lnOMb9bcWR
outros	Dia 15/05 no Auditório Ibirapuera! Projeto lindo cheio de gente especial! Vendas começam na quinta e https://t.co/YPeVmyQRPN
outros	Vai ficar parado? Vai colocar a culpa na política? Quer aumentar as vendas agora? A hora é esta! Sem https://t.co/gJGd3NJB3R
outros	Até parece que não precisam de vendas pra receber salário.
outros	Convenção de Vendas 2015 da FTD Educação ! Recepção maravilhosa do Paradise Golf &amp; Lake Resort ! Este https://t.co/b9bowZtaPn
outros	RT @andersonpant92: Maio tá chegando, ansiedade tá aumentando e as vendas tão a mil, vem que vem pra putaria  #Osdonos
outros	AVISO  Estamos em fase de reformas, para melhor atendê-los, Vendas online ou pelo contatos  051 https://t.co/82Q1CdC6uG
outros	Alô minha galera  hoje tem garota VIP fortaleza (esgotado ) e ponta pé inicial das vendas bloco https://t.co/L4Vzs86qZk
outros	As vendas abriram ontem de tarde,já ta no terceiro lote. Vai se fuderrrrr!
outros	@VitoriaC_sccp só olhar o número de vendas de camisa nos últimos anos.. Não fala besteira..
outros	Promoção Rádio Cidade! Realização Mallupy e 7 Tons! Vendas em http://t.co/ylVe4nceBp e Lojas Multisom @ Rádio https://t.co/KQQlXmsXcX
outros	Concorra a 5 mil ímãs de geladeira para BOMBAR as suas vendas! SORTEIO 15/05/15 AUMENTE AS SUAS https://t.co/wEoLCgafE1
outros	Hoje começa a venda do PG da Summer Tour, cadê vocês atualizando sobre as vendas? É mais importante isso do que os chatos
outros	Galera dia 2 de maio muda o lote então corra e garanta já seu ingresso com desconto! Vendas https://t.co/wlvidK24lG
outros	Executados na Indonésia recusaram vendas e cantaram antes de morte #G1 http://t.co/Kl6J6Rl4UT Quantos ele já ajudou a vicia.
outros	Gerente de Vendas - Marcopolis -  São Paulo, SP http://t.co/clAfC3gjfo #vagas
outros	O Diretor da Mamut Strong está no Rio Grande do Sul para fechar parceira de vendas. Você que deseja https://t.co/nwavYM5Y4n
outros	Aproveite as incríveis atrações de Las Vegas!!! Em até 10x sem juros!! Informações e vendas: https://t.co/fSenqvtOFO
outros	Produtores de flores estão otimistas com as vendas do Dia das Mães #G1 http://t.co/0c9cKLEcNV bom para dia das mãe.
outros	Sábado tem festa #Farra aqui na Vic! Garanta seu combo antecipado! Pontos de vendas: Victoria Haus https://t.co/w9YspbplUL
outros	"Qual é a doença dessas gurias que comentam "" CASA COMIGO"" nas fotos dos homens"
outros	Amizade é assim como casamento, na saúde e na doença, na alegria e na tristeza e até que a morte nos https://t.co/iMK3zmlRWa
outros	Hoje eu fiz essa jovem. Ela tem alopecia uma doença rara. E muito bom ver os fios sendo implantado, https://t.co/rnJBln7pcf
outros	quando alguém tem uma doença terminal as pessoas próximas buscam conviver mais. não sei se é bom.
outros	Reunião GT Odonto - Promovendo saúde bucal na infância #odontologia #odonto #UFRGS #PET @ Faculdade https://t.co/LH26RgloQd
outros	REUNIÃO DO CA  (@ CASCO UnB/FCE  (Centro Acadêmico de Saúde Coletiva)) https://t.co/mD2O8lLCD1
outros	Sacanagem é tu ter plano de saúde e mesmo assim demorar um mês a sua consulta, que raiva
outros	Mais de 3 horas pra ser atendido vergonha essa saude publica (@ Posto De Saúde Jardim Brasil) https://t.co/XR5LAVWJsZ
outros	já posso ir embora? (@ Ministério da Saúde (MS) - @minsaude in Brasília, DF) https://t.co/B5WRvOTR4k
outros	@Estadao: DENGUE: Chioro admite epidemia, mas nega mudança de estratégia; SP tem recorde http://t.co/PttAi9Y4WQ, lamentavel!!!!
outros	Noticiário..  Dengue tomando conta...gente vamos fazer nossa parte, evitar água parada, etc....
outros	@Estadao: DENGUE: Anvisa deve decidir sobre vacina até o fim do mês http://t.co/0KYv4OxOf6
outros	Esses novos números da #dengue no #brasil e o mega aumento de casos em #sp, são provas do descaso do governo e a falta de educação do povo.
outros	RT @gnatalini: Dengue bate todos os recordes. Nós ajude nesse combate. Tel 33964405 ou email natalini@natalini.com.br http://t.co/J4c1lxtdlz
outros	RT @gnatalini: Nosso Comitê da Dengue já distribuiu 400000 folheto, conversando com as pessoas. Conscientização.Prestação de serviço http:/
outros	85% dos criadouros da Dengue estão dentro dos domicílios. Portanto, mãos à obra: http://t.co/FOm8vZj5re
outros	RT @gnatalini: Nosso Comitê Civil Contra Dengue está prestando grande serviço no combate à doença. Vamos nessa! http://t.co/UHbXj6VBEa
outros	Nosso Comitê Civil Contra Dengue está prestando grande serviço no combate à doença. Vamos nessa! http://t.co/UHbXj6VBEa
outros	No hospital com minha mae, acho q ela ta com dengue afs mosquito maldito fdp
outros	@GordoGeek exato. As pesquisas mostram que a dengue hemorrágica acontece depois da 1 infecção. Ou seja, a 1 dengue não mata. A 2 pode
outros	@GordoGeek nao é assim. A teoria diz que: a 2 dengue vira a grave. Se vacinar uma a 1 pode ser a grave
outros	@GordoGeek pq a vacina deve imunizar os 4 tipos, ou pode aumentar os casos de FHD.  http://t.co/ztWtBO3uV0
outros	@intimidarei do nada me deu essa dor :(  tá foda, doi bem as juntas.. Tô com medo de tá com dengue
outros	Cuidado gente! Além da dengue e chikungunya, a zika está solta...
outros	"Foda foi eu no medico e a enfermeira"" queria pegar dengue, ninguém merece trabalhar em véspera de feriado"""
outros	O mosquito da dengue ja mato tanta gente que daqui a pouco vai ser entrevistado pelo gugu .
outros	São Paulo ta cheio de dengue e ngm fazê bosta nenhuma
outros	Culpa da globalização, estão entrando em extinção
outros	2019-O ano da extinção Aparentemente é um filme interessante, mesmo que tenha vampiros,
outros	RT @JuuPinzon: Essa gripe me mata, 40° de febre não é fácil de aguentar 
outros	Essa gripe me mata, 40° de febre não é fácil de aguentar 
outros	O primeiro comprimido pra gripe nao fez efeito, então pode me servir mais duas doses.
outros	Finalmente você sara da gripe e a garganta inflama, depois de levar dois banhos de chuva. Massa!
outros	Essa gripe chatinha que vai e volta
outros	Fiz a vacina da gripe, e tiveram q segurar na minha mão
outros	Não há mais limites para a tecnologia http://t.co/YJIsYOUOVj
outros	O que estas imagens estavam fazendo na FT da UNB??? @ Faculade de Tecnologia - UNB https://t.co/NLStguGLki
outros	ESSA FOTO PAROU  O MUNDO A INTERNET O TWITTER  A VIDA A TERRA O UNIVERSO A PÁTRIA AMADA IDOLATRADA SALVE SALVE http://t.co/ktn981MMg0
outros	Meu wifi ta muito bosta!!!! N tem nada q me irrite mais do que internet lenta. Pqp
outros	Fico tão de cara como consigo ser social na internet e tão anti pessoalmente
outros	RT @Fenelaomatheus: hj em dia vc não pode opinar nada na internet exemplo vc fala mal de cebola já vem os defensores da cebola encher o seu
outros	To sem wifi, sem crédito mas aconteceu um milagre e eu tô com internet de graça
outros	RT @SGdadepressao: Pesquisas realizadas pela SGDD revelam que descartar a bandeja no local próprio, na pça de alimentação do shop, não faz 
outros	Pesquisas realizadas pela SGDD revelam que descartar a bandeja no local próprio, na pça de alimentação do shop, não faz a mão cair.
outros	RT @Arquitrouxa: Pesquisas apontam que se vc se apaixonar, vc tem 100% de se fuder.
outros	LOOK OFICIAL DA FANÁTICA POR PESQUISAS/BIPOLAR/HIPPIE #movers http://t.co/DGApbZ70Ci
outros	Pesquisas apontam que as mulheres desapegam bem mais rápido que os homens 
outros	Rumo ao Centro de Pesquisas da GE com a @marthagabriel para o bate-papo O FUTURO DO TRABALHO do https://t.co/AmF8isO9zn
outros	De acordo com pesquisas, apenas 5% das residências no Brasil possui seguro. Pensando no conforto da https://t.co/lpua0u2ru9
outros	Vamos conversar sobre pesquisas em Ciências aplicadas à educação?! Prof. Roberto Lent na II Reunião https://t.co/DLi9brzufF
outros	Abriu o concurso para provimento de cartórios aqui no RS. Valor da inscrição: R$ 450,00. Defina razoabilidade/confisco.
outros	#Repost @redbullbr with repostapp.Pilotos amadores comandam o volante dos veículos construídos https://t.co/P8SeimJYf5
outros	@carronews: GM planeja parar de produzir veículos na Venezuela em julho http://t.co/vUuvcCUGrm #uolcarros
outros	Sede da @gmrio : veículos parados em retorno, na rua e isso é normal... Vergonha essa GM que não faz nada certo. Bando de babacas...
outros	@silvanaramiro Aqui em Santa Cruz é caos no trânsito. Veículos contramão e na faixa do BRT e na cara da PM e @gmrio . Ninguém faz nada...
outros	http://t.co/ukjpwsKsvr acesse &amp; confira nossas ofertas !!!!!!!! @ viperveiculos https://t.co/hTAxphIFnC
outros	O artista tem que voltar a ser o maior beneficiado, em vez das gravadoras, distribuidoras e veículos. Valorizar a música pela música.
outros	Mini girassóis em presilhas. Em várias opções de cores. Uma paixão só!! Em nossos pontos de vendas https://t.co/xLOtlgtcTR
outros	Vai ficar parado? Vai colocar a culpa na política? Quer aumentar as vendas agora? A hora é esta! Sem https://t.co/i5XVwHmOQZ
outros	@kittensperry contando com as vendas online, no allianz eu tava estimando que tivesse uns 1000 ingressos, provavelmente 400 meias
outros	Perfume Ferrari black 125ml CAMPEÃO de vendas na Giovanna Imports!  #santos #levantaeanda https://t.co/A0hm52nCGo
outros	HR-V da Honda no top 15 de vendas do país, e vcs tão falando em crise? Na boa, isso é desculpa pra meter a faca em produtos e serviços
outros	Garanta seu combo antecipado! Pontos de vendas: Victoria Haus (Saan - 61 9552-2891) e http://t.co/gfQOLzGQJy (307 https://t.co/RrLEagvOBS
outros	Trabalhando nas vendas do Residencial Capri- Ilhas Gregas 2 no Sítio Vale das Brisas em Senador https://t.co/ygj9GVIZS6
outros	Acessorios lindos @glamour_sjc #glamour #asthays #photo Vendas por WhatsApp e online!!!  olha https://t.co/ls4uijNsyZ
outros	@FlorFabeiro98 no hacía falta que me vendas igual, jajajajajj te
outros	Corre e garanta seu combo antecipado pra HOJE! Pontos de vendas: Victoria Haus (Saan - 61 9552-2891) https://t.co/EJhpI9USy3
outros	Morning - job de ontem - consultoria de imagem empresarial - incentivo as vendas através da auto https://t.co/EAM2RllqOR
outros	Vem aí a Festa de Lançamento e o INÍCIO DAS VENDAS para o Baile mais charmoso e esperado do Brasil! https://t.co/SqyNVOhFKy
outros	Usufrua do melhor de Salvador!!! Em até 10x sem juros!! Informações e vendas: https://t.co/Zgpr6cA3N0
outros	Que o dia seja de conquistas!   #bomdia #chamaQueVem #conquistas #vitória #vendas #work https://t.co/N4E4UwcSpm
outros	Casa própria: analistas veem freio nas vendas e redução de preços http://t.co/71EnaLOAse
outros	Meia entrada para vascaínos já esgotou em menos de 50 minutos de vendas!   Os modinhas tão danados! A festa do Vasco será top! Kkkmm
outros	Garanta seu combo antecipado! Pontos de vendas: Victoria Haus (Saan - 61 9552-2891) e http://t.co/gfQOLzGQJy (307 https://t.co/NpJ0kDsnDE
outros	Calça com relevo e Cropped de moletom spot_fit vendas em atacado e varejo http://t.co/am3LegeJTY @ https://t.co/nOzqxZrVDM
outros	Garanta seu combo antecipado! Pontos de vendas: Victoria Haus (Saan - 61 9552-2891) e http://t.co/gfQOLzGQJy (307 https://t.co/unL6cS3uEy
outros	Caminhões - MAN Latin America quer incrementar vendas de caminhões por consórcio: A ação será realizada no per... http://t.co/1iDdfM6AzD
outros	Acho que o ingresso deveria ser vendido no Allianz. Ponto. Porém me lembro da ultima vez q o clube tentou organizar as vendas, quebraram TD!
outros	Colar chave + pena só R$30,00  (troque cores e pingentes, vendas em atacado e varejo) @ Whats: https://t.co/SglHi51jOH
outros	#Repost villamixcj Mais sorte ainda é ter sexta e sábado Villa Mix Campos do Jordão!! Vendas https://t.co/LpKm4uKHeK
outros	$PN$ é tão imbecil que nem pra se responsabilizar pelas vendas de ingresso em SP. Ele tá pouco se fudendo pra torcida..
outros	#VENDAS #ABERTAS nas lojas #South Para #FestaGenesis com MARCELO D2 &amp; ONZE:20 - Quarta 03 de Junho https://t.co/hyXb4SIyeT
outros	Apos o sucesso de vendas do primeiro lote, estamos começando a venda do segundo lote, então corra https://t.co/tMIwvaAksh
outros	Começou a temporada de vendas da dlxfashiondesign no @gabriii, logistas venham conhecer nossa coleção https://t.co/xeCSraC8t0
outros	@SCInternacional quando começara as vendas dos ingressos para os não sócios?
outros	Dois lindos colares, cada um por R$25,00  (vendas em atacado e varejo/monte a sua a gosto) @ Whats: https://t.co/WSMk53lUPZ
outros	próximo ao das ações em si. Racismo, machismo, homofobia, etc. Nenhuma dessas bizarrices é uma doença, por exemplo. São apenas pura e
outros	Oficina Nacional de Avaliação do Programa de Educação Popular em Saúde no SUS! @ CENAM - Centro de https://t.co/iHosYEnGVh
outros	No TUCANATO em SP 400.000 tiveram dengue desde do início do ano. Sem saúde educação, segurança e corrupção rola solta. VAMOS PARA PAULISTA?
outros	Hoje em dia pra vc conseguir atestado médico no posto de saúde só no caso de amputação, e olha lá
outros	Agora, se seu peso tem sequelas sobre sua saúde, sanidade, auto-estima, vai atrás e emagrece da forma certa.
outros	(4) Acho que ninguém deveria fazer dieta. Se você cuida da sua alimentação, ta com a saúde ok, e é gordinha, foda-se tudo porra.
outros	JURO QUE ESSA TAL DE DENGUE ESTA QUERENDO PREJUDICA MUITA PESSOA! GERAL COM ALGUM SINTOMA
outros	Meu pai é foda,  a gente nao pode nem deita um pouco porque ta com dor no corpo que ja ta com dengue
outros	Ja peguei dengue duas vezes cês não tem noção do medo q to de pegar de novo
outros	Depois de 15 dias parado por conta de estar com dengue hj tive a oportunidade de voltar a fazer o que https://t.co/WLCT4xhXvj
outros	Dengue bate todos os recordes. Nós ajude nesse combate. Tel 33964405 ou email natalini@natalini.com.br http://t.co/J4c1lxtdlz
outros	RT @milalopes_: gente, os sintomas da dengue são uma tortura SEM FIM. agora minhas mãos e meus pés deram pra coçar e eu TO PRA MORRER DE TA
outros	RT @gnatalini: 85% dos criadouros da Dengue estão dentro dos domicílios. Portanto, mãos à obra: http://t.co/FOm8vZj5re
outros	São somente 2800 agentes anti dengue para 3,5 milhões de imóveis. Mosquito ganhando de 10 a zero!
outros	Nosso Comitê da Dengue já distribuiu 400000 folheto, conversando com as pessoas. Conscientização.Prestação de serviço http://t.co/Va175TS6dk
outros	@VoceNaoSabiaQ: Existem aproximadamente 5.000.000.000.000.000.000.000.000.000.000 de bactérias vivendo no planeta terra. Culpa da dengue
outros	RT @LopoDinis: Assim como tentaram nacionalizar o problema da falta de água em SP, agora tentam com a dengue. Coisa feia @TvBandnews, cobre
outros	ZIKA VIRUS RT @JornalOGlobo: Zika Vírus descoberta por pesquisadores brasileiros provoca doença semelhante à dengue.  http://t.co/PvK6ljU6VY
outros	"Treinamento do dia ""D"" de combate a dengue! #medimed #meduffs #medupf (@ Faculdade de Medicina - FM) https://t.co/yxb57hlmB4"
outros	. eu tenho um medo desse negócio de mosquitos da dengue geneticamente modificados..
outros	Amanheci com o pessoal da dengue com febre, gripe, frio e saudades. Me pergunto se não seria minha hora de partir.
outros	Aqui vemos três exemplares de cobras em extinção http://t.co/ppvxFUorTL
outros	Ê balancê balancê escute que vou dizer  a festa da raça está em extinção  vocês viram na https://t.co/zvNbjV8SEP
outros	@VoceNaoSabiaQ tá explicado o risco de extinção
outros	A artista estelleflores da copiadora Selva Press veste camiseta Estojo, com estoque em extinção. A https://t.co/bi1FPOnyWi
outros	Elas estão cada vez mais em extinção. @ Vila Madalena https://t.co/Hnca9uFcWJ
outros	Tomando cerveja com meu pai e debatendo uns papos sobre física e astronomia, eu amo meu pai
outros	Um passeio pelo Universo ...  #Astronomia @ Planetario da Gavea https://t.co/DZ3a8Y3LRq
outros	tenho que estudar umas leis de kepler pra as olimpíadas de astronomia
outros	Essa gripe me mata, 40° de febre não é fácil de aguentar
outros	eu nao melhoro dessa gripe logo meu, q raiva
outros	Tava reclamando de dormir sozinha, agora to dormindo com a gripe, a noite todinha grudada em mim
outros	Baa fui fazer aquela vacina da gripe hoje e na hora nem doeu nada, Mas agora parece que levei um soco no braço.
outros	Segunda é o dia mundial do #AgoraVai !  tentando espantar a gripe com mtoo suor!  #cardioday https://t.co/kW0gnsKjvM
outros	Tomar vacina de gripe é um povo ignorante esses da saúde (@ Centro de Saúde nº 05 in Brasília, DF) https://t.co/B6Wdj3KRX5
outros	Fiquei tanto na friagem que agora a gripe me derrubou
outros	Aaaaah gripe não .
outros	A merda é que esse final de semana a minha gripe piorou e eu to sem voz. Que foda
outros	Vou fazer essa lista e estudar pq a gripe n vai me deixar dormir msm então vou fazer algo útil
outros	Gripe dnv não
outros	@jornalnacional Quero minha vacina já.
outros	RT @AZEALIOBANKS: @_MaryanaMaia SOU TAO BOM COM VC E OQ RECEBO EM TROCA MENSAGENS DIZENDO Q EU QUERO DA O CU POIS BEM N VOU ME VINGAR PQ VC
outros	@_MaryanaMaia SOU TAO BOM COM VC E OQ RECEBO EM TROCA MENSAGENS DIZENDO Q EU QUERO DA O CU POIS BEM N VOU ME VINGAR PQ VC TOMOU VACINA NO CU
outros	eita, vamos ter que tomar mais uma vacina? Ah não
outros	Estou muito nervosa amigos terei de tomar vacina hoje ai Deus por que não nasci com esses anti corpos já??? Que vontade de desistir da vida
outros	O bom é q desse jeito n posso tomar vacina \o/
outros	Olha aqui cretina, contra cachorra nos temos vacina
outros	@GordoGeek então a vacina tem de ser direto para os 4 tipos, ou pode aumentar letalidade
outros	@GordoGeek então, se a vacina imunizar somente um sorotipo, quando contrair os outros pode desenvolver a forma grave da doença.
outros	"Escândalo vomitante: familiar meu foi fazer. a ""vacina no posto de saude da gloria...bairro gloria.Tem una placa na porta escrito...."
outros	Vacina... Ouch! (@ Núcleo de Medicina do Viajante in Sao Paulo, São Paulo) https://t.co/Xmq7xGcc3F
outros	Dia de vacina. Hoje foi a de 3 meses, contra meningite, uma picadinha só (mas suficiente pra mamãe https://t.co/0hWx0LcPYA
outros	Ah ta! Preso tem direito a vacina da gripe, professor não! Ê governinho de m#rda! @RdGaucha
outros	Ktchoras #EstéticaeCosmética  @ Centro de Educação em Tecnologia - UPF https://t.co/RlnBK5SrNZ
outros	"RT ""@AndreLJunq: Samsung e Marvel usam realidade virtual em campanha http://t.co/7qXPZiPY9s #Marvel http://t.co/EHxwjJN6Qj"""
outros	"@wesleicurtinaz WP  ""@g1: Emojis do Windows 10 incluem dedo do meio e novos tons de pele http://t.co/LQNFDstsMA #G1 http://t.co/iiZmxw8BQp"""
outros	FRESH POTS!!! @ DocCenter Tecnologia em Documentos https://t.co/qbuDgu0cqn
outros	Realizando o sonho do museu fechado (@ Museu de Ciências e Tecnologia (MCT) in Porto Alegre, RS) https://t.co/AhiBVo9l8p
outros	Museu de Ciência e Tecnologia da PUC ; ) @ Museu Da Pucrs https://t.co/XlidnG4uBY
outros	 @ Museu de Ciências e Tecnologia da PUCRS https://t.co/9dW9ksSRJm
outros	"Louco... ""@JornalOGlobo: Hacker implanta chip na mão para invadir celulares com Android. http://t.co/sW6qBbcyqW http://t.co/BPmdWx0Tp9"""
outros	@itsmarinunes Tanto erro médico em prescrição! E como ajuda o paciente a aderir o tratamento! Sem isso a tecnologia não serviria pra nada!!
outros	Abra um pouco mão da tecnologia e curta a natureza que existe bem a sua volta, que na rotina do dia a https://t.co/41aGjwcb57
outros	A Life Telecom revolucionou e lançou ontem em Marília a sua TV por assinatura com tecnologia de fibra https://t.co/jzbtnNmyRw
outros	Apenaxxxxx! 18 hrs que não chega! Hahaha @ Kinagua Tecnologia e Serviços Ltda https://t.co/tWSn9fedDU
outros	RT @STJnoticias: Consumidor que compra pela internet tem assegurado o direito de se arrepender http://t.co/YhEG4mhgYx
outros	E aí? O que está esperando para sua Empresa ter novas oportunidades de negócio na internet? Solicite https://t.co/ucYgYxMCJE
outros	a internet ela é maravilhosa né amplificou td q ha de bom e td q ha de ruim em ser humano (principalmente o ruim)
outros	hj em dia vc não pode opinar nada na internet exemplo vc fala mal de cebola já vem os defensores da cebola encher o seu saco e cagar regra
outros	... dice. no tenia #internet... dios casi me #muero_
outros	EU AMO A INTERNET http://t.co/vj6gSKMpSb
outros	cara, eu deveria estar fazendo muitas paradas, mas não, mais uma vez a internet me prendeu com esse jeitinho de ser.....
outros	RT @luizassouza_: @abattikaka não pago internet p ler isso
outros	Internet não perdoa #metgala2015 #metball #riri @ http://t.co/SX7sZIzI6X https://t.co/iHzSr0B8c8
outros	Adolescentes de hoje: -Coma Alcoólico -Grávidas aos 13 -Fumar/Droga  Eu: -Internet -Comida -Dormir  -Estudar   MINHA MÃE DEVIA TER ORGULHO.
outros	Atualmente evito fazer comentários na internet pois não meço meu clubismo, mas vamos ao que https://t.co/L8KeUcYWgy
outros	 Fernando e Aline assumem namoro em rede social http://t.co/xOBF6N9UYe via @DiarioPE
outros	ligo a tv tem gente chorando olho as rede social tem gente chorando a vida ta mt triste vamo todos se mata
outros	Era uma vez um casal que nao tinha nenhuma rede social e viveram felizes para sempre
outros	Não sei qual é a graça posta tudo da vida em rede social, só pra todo mundo ver sua vida.
outros	Para conquistar mais seguidores no Facebook siga algumas dicas para ter mais sucesso na rede http://t.co/JHDoOvNEJW
outros	Hoje vou misturar resfenol com cerveja novamente me aguardem mais tarde chapado nessa rede social
outros	Tira 50 fotos, exclui 40, edita 10 e usa 1 em tudo quanto é rede social. Prazer, eu.
outros	Segundo estudos, dormir de óculos na rede social permite ter melhor ponto de vista a respeito dos https://t.co/0UV4CFYFER
outros	Do meu ponto de vista, o onírico, a melhor rede social. @ Palácio de Huan Ti Nei Su, o Imperador Amarelo https://t.co/cxvOviyjRo
outros	Na rede social mais importante do reino. Nas tramas da rede do sonho. https://t.co/CroGbNV72C http://t.co/Okfoh7Ty8r
outros	Nem sabia que o Justin Timberlake tá no filme Rede social.
outros	A rede social da prefeitura de Curitiba é irada faltam ensinar bons modos pra PM.
outros	RT @SGdadepressao: Pesquisas realizadas pela SGDD revelam que descartar a bandeja no local próprio, na pça de alimentação do shop, não faz
outros	Fazem pesquisas sobre tantas coisas inúteis. Mas nunca vi uma que respondesse a minha pegunta: Por que Twittar vicia tanto??
outros	@pedrodefelicio Prof., por ter participado do AgroTalento, comecei a pesquisar coaches de desenv. pessoal, e nessas pesquisas achei ele!
outros	4ever arrependida de ter trocado a viagem à SC na páscoa p/ Alice vir p/ cá. Agora, c/ esse mundaréu de pesquisas, ñ vou lá tão cedo.
outros	Pesquisas realizadas por mim mesmo revelam que eu preciso ficar milionário logo, não ta facil essa vida de pobre
outros	RT @robstatarin: Não basta ter reeleito o Beto Richa no 1° turno, agora o Ratinho Jr lidera as pesquisas pra prefeitura de Curitiba.
outros	RT @A_Complicad: Pesquisas apontam que as mulheres desapegam bem mais rápido que os homens
outros	Vamos conversar sobre pesquisas em Ciências aplicadas à educação?! Prof. Roberto Lent na II Reunião https://t.co/oeWzu9o70l
outros	Se eu tirar 8,4 em ciência na recup eu vou fazer um bailinho pra comemorar pq vms combinar chance zero de tirar isso
outros	se não tiver devolutiva de ciência política hoje, eu juro que vou parir um filho no meio da sala e dar de presente pro Dean
outros	Pra quem queria um tema científico e filosófico para refletir no domingão, ofereço este aqui.  http://t.co/msa9PWQvhI
outros	"Porque por mais que eu ""trabalhe"" com Ciência pura, é mais q comprovado que tem q ter algo que comande q porra toda"
outros	Fico viajando vendo esses negócios de ciência
outros	Ciência é uma exploração de tudo que é desconhecido.
outros	RT @choiyounjae: Sentimento não é comigo, sempre procuro as respostas em coisas lógicas aka ciência.
outros	"O ""Divulga Ciência"" recebeu o diretor do marketingLAB, Marcos de Oliveira, para um bate papo sobre https://t.co/FHpT62C4vw"
outros	Sipa fui mal na prova de ciência
outros	Deus é mais  (@ Instituto Federal de Educação, Ciência e Tecnologia de Goiás (IFG) - @ifg_goiania in Goiânia, GO) https://t.co/KlxSyaIOG7
outros	O sábio não é mais do que a ciência da felicidade.
outros	E é sempre assim com as Amigas do IFG \\// #SomosIFG @ Instituto Federal De Educação, Ciência e https://t.co/33bmhIvBK4
outros	Não importa a onde vamos, importa que temos de ir !!  @ Museu Da Ciência De São Carlos https://t.co/TZ5ewCpl27
outros	"Pela dedicação à excelência da arte e ciência da Odontologia Estética, de acordo com os mais altos https://t.co/7uYcaSv0Xq	2015-04-29 20:28:52"
outros	A Ciência da Computação não tem limites em suas invenções. A equipe Swisando está se divertindo muito@swissnexBrazil http://t.co/bBHAIWjlf3
outros	Venha participar do encontro sobre robótica, na Casa da Ciência da UFRJ. Hoje, a partir das 14:30 horas. @UFRJ http://t.co/3v4sbXn67L
