outros	LEI SECA - Novos veículos e bafômetros reforçam operações do Detran em Rondônia: As operações Lei Seca e Ca... http://t.co/SapAV0OAvx
outros	Hoje foi meu último dia de estágio nas aulas de artes da prof becanaboa no CEJA. Meu estágio III. https://t.co/59jTauKUsh
outros	Estágio  com a Gloritcha  #riobranco #coletivaII @ Instituto Estadual Rio Branco https://t.co/eeZszzeAMB
outros	@BBBitolada não é mesmo, mas cheguei num estágio que não consigo nem mais conviver no mesmo ambiente
outros	Oficina Nacional do Projeto de Educação Popular para Agentes Comunitários e de Endemias no SUS!!! @ https://t.co/9Gn9IO4rDj
outros	De preto na segunda-feira pela educação do Brasil e em solidariedade aos professores do Paraná. @ https://t.co/mM6ZkCHX01
outros	Atleta morre atropelada, o assassino diz que corre mesmo com o carro, ele não presta socorro e ainda sai impune. Brasil... @CesarFilho
outros	@gus_tavohenriq nao mudou nada então pq tudo p ele no Enem é assim nos vestibulares é assada , isso  é uma chatura viu
outros	quem eu tirei 820 na redação do enem e só descobriu 3 anos depois, e nunca usou a nota??? sim eu
outros	Não fui inteligente pra passar na faculdade com enem agora to indo trabalhar nesse domingo lindo pq tenho facul p pagar, é isso msm
outros	@CarolCoutinho9 hayshsus.. estudo todo dia, só fds q n kkkkk esse ano vou o fazer Enem :3
outros	RT @kallekc: (ENEM-2015) vc tá a 12m do fluxo e avista uma novinha em um ângulo de 45 graus. o que ela quer?  a) galho b) vara c) ripa d) b
outros	Queria sair mas com minha mãe aqui teria que responder à um questionário tal qual enem. Então vou dormir pois é feriado
outros	RT @pollyLDantas: (Enem 2015) você está a 13 metros do fluxo e avista a novinha num grau de um ângulo de 45, responda agora o que ela quer?
outros	Eu fiz o ENEM pra conseguir me inscrever no FIES e não vou conseguir pq simplesmente não tem vaga no meu curso quando na verdade tem
outros	To querendo fazer cursinho pré enem, mas eu juro que se eu não passar eu me mato
outros	Tenho que fazer 3 redações diferentes à nível de enem pra amanhã e to só enrolando...  Adivinha quem vai madrugar hoje
outros	@DeadnWalking eu to tirando umas férias pro ate o enem
outros	@zerrieighteen sim, hj eles vão fazer uma aula ao vivo sobre o conteúdo do enem e de graça
outros	RT @falatukamikaze: @Porrabielll se for fazer o enem, não esquece daquela caneta que eu te dei na praia mano
outros	@Porrabielll se for fazer o enem, não esquece daquela caneta que eu te dei na praia mano
outros	RT @guiadoestudante: #Agenda ESPM-Rio abre inscrições para vestibular 2015.2 http://t.co/17GIiUReef
outros	qualquer um vai entrar na usp se ela aderir ao enem ah claro ate pq qualquer um faz mais de 790 de media no enem mesmo ne
outros	"RT @niqsan: ""E é por isso que mais de 500 mil zeram no ENEM"" -ApareCIDA, Maria"
outros	RT @NeeetuAlves: pra vocês que não vão na aula eu só digo que : to na frente de vocês no enem
outros	E é por isso que mais de 500 mil zeram no ENEM -ApareCIDA, Maria
outros	(ENEM-2015) você esta a 12 metros do fluxo e avista uma novinha em um ângulo de 45° graus. De acordo com as leis de Newton, o que ela quer ?
outros	Sobre essa prova simulado do enem, quase me matou, e amanhã tem mais
outros	Ctz que n passo agr no meio do ano kkkkkk ja to dando ideia que vai ser no ENEM que vou virar medico
outros	Vo fazer de tudo p tira muito ponto no enem esse ano, não to nem ai se to no primeiro ano e q não posso fazer faculdade kkkkk
outros	tipo que não basta você fazer curso, trabalhar, estudar, estudar pro enem e ainda tem que estudar pras provas, que é daqui a uma semana!
outros	Agora o site fala que o site do ENEM tá indisponível e não podem ver a minha nota pra concluir o cadastro
outros	A pressão de conseguir nota de novo no Enem cada vez aumenta, vou pirar!!! Juiz filho da puta
outros	se a redação do enem fosse sobre memes eu tirava nota máxima
outros	1º lugar do ciclo do enem quer RI agr vcs me pergunta como que eu vou competir c o bicho
outros	Quero muito passar no enem , e vou conseguir  medicina na bala
outros	@lsmyputo eu deveria estudar p enem, mas n tenho tempo de nem pra estudar pra faculdade uahaha. To tentando terminar uns dos meus trabalhos
outros	anciosa pro resultado do enem
outros	 O mundo após a guerra fria - História - Super Aulas ENEM - Curso Positivo - YouTube https://t.co/fJBMj4RuLQ
outros	 Dica para ENEM - Regra de Três Composta - YouTube https://t.co/N3Kovemuxh
outros	inscrições do enem so mês que vem né
outros	ou sera o contrario  harry tops quando quer foder  louis tops quando quer fazer amor  to na duvida  pior q questao d enem
outros	Tenho que começar a compra as apostilas do ENEM.
outros	Boatos que o tema da redação do enem ta rolando lá... E vcs ai que não vão passar pq não sabem falar sobre os assuntos
outros	Deus é mais n quero saber de enem esse ano, me matei ano passado pra conseguir crl nenhum vtnc #askbelieber
outros	a palavra enem já me lembra pressão, nervosismo, dor de cabeça, cansaço entre outros #askbelieber
outros	Tenho q ver o lugar logo p começar meu pré enem,menos no Junior...
outros	esse simulado enem dia 16 nossa que incrível quase tão incrível quanto ser crucificado ne não?
outros	Como assim pra fazer FIES tem q ter feito enem eu achei q era boato
outros	Se nem no enem o povo passa imagina entrar em Harvard kkkk !
outros	@frasttt sim  to preocupada com o vestibular e o Enem   fodeu
outros	Nas minhas férias de julho quero estudar ao maximo p enem
outros	ENEM podia ser amanhã já pra eu fazer e acabar com essa expectativa
outros	'Harvard deveria ter mais brasileiros' o povo passa no ENEM  chorando,  imagina entrar em Harvard, não passa nem do portão kkkkkkkkkk
outros	(ENEM-2015) vc esta a 12M do fluxo e avista 1 nvnh em 1ângulo de 45°G. D acrd com as leis d Newton,oq ela qr? A) Sal B) Pão C) Pau D) Mingau
