outros	LEI SECA - Novos veículos e bafômetros reforçam operações do Detran em Rondônia: As operações Lei Seca e Ca... http://t.co/SapAV0OAvx
outros	Lise Meitner, símbolo da luta pela igualdade de oportunidades p/ mulheres na ciência.  Leia a história dela lá no perfil do @victorcaparica.
outros	Meu dia pode até começa bem mais vai acaba mal, tinha que te mais ciência disso
outros	Audiência Pública e reunião pró-frente parlamentar em defesa da Ciência e Pós-graduação, inciativa do https://t.co/PfKQXx2oLb
outros	Hoje a noite foi das meninas! Já em clima de despedida...  #fériasnoRJ #despedidajácomeçou https://t.co/0B3eFacCF0
outros	No clima das Olimpíadas...agora é torcer pra ser sorteada!! Boa noite @ Home Sweet Home https://t.co/N9XHruDtqM
outros	Que este clima no te pare !!! (@ ALL IN Cardio &amp; Fitness in Asunción) https://t.co/TuuKiNxszd
outros	E hoje o clima foi de despedida... Um ano e meio depois, saio com o coração partido e por outro lado https://t.co/M0im4GDOfr
outros	O clima esta conspirando contra minha vida fit,não poderia chover mais tarde
outros	São Gotardo pode ser ruim o tanto que for, mas o clima e o céu dessa cidade é divino.
outros	Dá pra acreditar nesse clima em Sumaré? @ Sumaré https://t.co/OXeJcwX5yt
outros	O clima hoje foi de #convocação com mckoringa no @rodrigoarrasta! No ar dia 16!  from https://t.co/ADgUVvUmwF
outros	A Atual Fashion está no clima do dia das Mães, tudo lindo com muitas opções de presente, além de https://t.co/j72RrEgSj9
outros	 - MC JOY - Clima em Cima Funk. Feat Dj Detonna - Contatos para shows:   (21) 97467-6885 https://t.co/tnAHKwj51V
outros	Sempre vou curtir o clima e zuar, mas se vacilar volto pra pisar e cuspir em cima!
outros	Chuva até o final do dia galera !!! #clima #previsãodotempo #PraiadaBarra @ Praia Da Barra - Posto 5 https://t.co/VcMZ0PBB4U
outros	Ainda sobre sabádo , ao nosso clima  #NemGostamos #CoisaLinda #AmoVcs #ÉoTchay #Familia @ https://t.co/ybdmm9xaBf
outros	Brigas, intrigas, segredos de nós dois Não tem mais clima, chegou ao fim E a culpa não é minha Eu tinha certeza de nós dois
outros	LAS do Brasil  clima de dia das mães  @ Las do Brasil https://t.co/02oc2YGMap
outros	Sigo afirmando que se o clima está estranho, o dia fica estranho também
outros	Indo pra casa depois do show... Clima regular, Boa música, Ótimo divertimento e Excelente companhia. https://t.co/yFqjHzVscb
outros	Ih mein, essa estufa só tem as plantas da mamãe. @ Jardim Botânico - Curitiba, PR. https://t.co/22lV3NAIRH
outros	@Estadao: Aquecimento global poderá extinguir uma em cada seis espécies tomara q seja a espécie humana
outros	eu acredito que isso de aquecimento global é um ciclo que a terra passa, de aquecimento, resfriamento ai aquecimento dnv
outros	É TUDO CULPA DO AQUECIMENTO GLOBAL !!!!!
outros	Alô casais e apaixonados do meu Brasillll!! Tá rolando concurso no perfil do @do_leblon  Sente só: https://t.co/G5LwdOJllF
outros	Que Deus me abençoe neste concurso, vou precisar!
outros	Alguem pode resumir o edital do concurso da prefeitura p mim?? Pqp
outros	Meu pai quer por quê quer que eu passe em um concurso público
outros	Hoje vou começar estudar p outro concurso, nesse eu preciso passar
outros	Pq tava sozinha hj, povo ta em Sao Gabriel pq a gorda tinha concurso
outros	E vamos de concurso!! Prova do SEMAE! LET'S ROCK!! (@ Universidade Paulista (UNIP) in São José do Rio Preto, SP) https://t.co/hRIZYo07oU
outros	Não basta ta estudando pra escola, Enem, agora vou ter q estudar pra concurso, alguém para tudo q eu quero desceeer!
outros	Vou ser jurada no concurso dela. Valéria sempre lembrando de Restinga em seus eventos..
outros	Visitando União da Vitória! Amanhã concurso! Seja o que Deus quiser!  @ Ópera Hotel https://t.co/ktvSTJF8vT
outros	"Concurso #Mallala Dia das Mães - ""De selfie com a Mamãe"" pra você que é mamãe, para você que vai ser https://t.co/SHsGglEwkk"
outros	Presente hoje no concurso Soberana das Piscinas do Rio Grande do Sul. Parabéns ao marcelosoes pelo https://t.co/Imx9HopR6k
outros	Vai começar!!!  A foto vencedora do nosso concurso de fotos de viagem #eunoizapelomundo de abril será https://t.co/Pi9wKbEimb
outros	E cobertura 2015 do @_comidadibuteco continua firme e forte! Uma das certezas desse concurso... é que https://t.co/nRvJvJoRKQ
outros	A pessoa faz concurso lá tem o valor que vai receber ,ela passa e fica fazendo protesto para ganhar mais, si acha pouco não faz o concurso
outros	"Meninas estou organizando um Concurso de maquiagem ""Antes e depois"", para se cadastrar basta https://t.co/lzdLTzvHtq"
outros	Prof de soc jurídica passou num concurso da defensoria e não vai mais me dar penal no próx semes &lt;/3
outros	Gente,  atenção! O @Palmas_Shopping vai fazer um concurso pra escolher minha companhia para o cinema kkkkkkk
outros	Concurso pra professor de faculdade 14.000, obvio que vou dar aula em faculdade
outros	Será muita pressão devido ao término? Monografia, concurso, estágio...
outros	Esta é a quarta e última finalista do nosso concurso de fotos de viagem #eunoizapelomundo de https://t.co/qxxrNs3XbN
outros	"A escolha de suas amizades deve funcionar como um concurso público. O processo seletivo é árduo, mas https://t.co/fnL6WNSZjS	2015-04-28 23:03:35"
outros	RT @el_ianaa: @EmilyKouketsu amor, eu vou fazer direito, pra entrar no concurso, mas não passa com tatuagem. OLHA QUE LEI PORCA
outros	Era esperado 300 pessoas pra fazer o concurso hoje. Se foi mais de 70 é muito.
outros	Gostaria de uma prova de concurso com 100 questões de gramática e nada mais. Que matéria delicinha &lt;3
outros	Amigas chorando pq foram mal no concurso do @TJSPoficial, eu tbm poderia estar nessa bad mas não estou pois nem fiz o concurso
outros	Decerto ta na hora de estudar um pouco, o concurso é daqui um mês já,  ahahah. Ferrou-se
outros	Amanhã vou me inscrever pro concurso de soldado da pm!!
outros	Meu novo livro hj lançado no Congresso Brasil. de Gestores e Membros de Comissao de Concurso Público!!!! http://t.co/3UijhoJmSm
outros	pq vei, desses 10 pelo menos 7 querem medicina, e ainda tem as outras escolas... são só 10 vagas pra medicina no PAS
outros	Imperdível! Restam apenas 5 vagas para PORTO SEGURO com o valor promocional. #TribosJovem https://t.co/CR7qGJRp1V
outros	Você começa a trabalhar, e do nada o Brasil e o mundo começa a ligar pra sua casa falando de vagas.
outros	RT @chatead4: procurando vagas de emprego na área de dormir
outros	O jornal fala de emprego como se o Brasil tivesse ostentando vagas e fosse muito  fácil conseguir um.
outros	Oficina de encadernação neste sábado dia 09 de maio. Faça já sua inscrição, as vagas são limitadas. https://t.co/qtQ7jxLMrz
outros	Últimas Vagas!!   Curso PILATES NA GESTAÇÃO com Silvia Gomes em Campo Grande/ MS   CAMPO GRANDE/MS https://t.co/6geQfXLRW3
outros	Com certeza, o melhor material e o melhor curso que já produzi!!! Aproveite, as vagas estão se https://t.co/3l5rbfN46A
outros	ontem no big uma mulher ocupou 2 vagas no estacionamento, cerquei o carro dela de carrinhos e deixei um bilhete escrito otária JUSTIÇA SMP
outros	RT @xhoranfactor: imagens exclusivas do trabalho de liam payne nas horas vagas da gayband one direction #LIAMISTHEPOOLCLEANER http://t.co/P
outros	Sábado de estacionamento sem cobrança na avenida JK, e com vagas disponíveis nos diversos bolsões.
outros	No primeiro semestre deste ano, já foram oferecidas mais de 400 mil vagas no ensino superior por meio https://t.co/P1hATTQhDL
outros	HOJE Sexta feira no H2 Club Ribeirão Preto temos   Satelite Open 100K - Freeroll 5 VAGAS https://t.co/zKz8Ba5jyB
outros	Baby as palavras estão mudas As conversas tão vazias  As explicações são vagas
outros	HOJE Sexta feira no H2 Club Ribeirão Preto temos   Satelite Open 100K - Freeroll 5 VAGAS https://t.co/VJ2bcwKCZj
outros	Não há vagas pra quem não aproveita as oportunidades!
outros	Últimas vagas!!!  Vamos galera.  Curta http://t.co/Jbgx26plvp e inscreva-se  @ https://t.co/OkCOTOERBK
outros	Sou o tipo de pessoa que fica procurando profissões nas horas vagas
outros	Channel Operations Processes Analyst - GE Healthcare -  São Paulo, SP http://t.co/FwSgw2bzy4 #vagas
outros	ESTAGIÁRIA PARA ÁREA COMERCIAL - ALPHA SECURE -  São Paulo, SP http://t.co/eMvzl4iRCq #vagas
outros	Olha que iniciativa bacana! Para os engraçadinhos que estacionam em vagas para deficientes ! A Santa https://t.co/KqnhpZrI4U
outros	Regional Sales Manager - Novo Nordisk -  São Paulo, SP http://t.co/ve8gRahiXe #vagas
outros	Product Manager/Strategy 5-ProdDev - Oracle -  São Paulo, SP http://t.co/UffOy1if31 #vagas
outros	@tomlinsombrio esquece, liguei no senai e só abriram uma turma, pensei q tinham aberto vagas de vários cursos
outros	Primeiria vez na vida q tenho duas aulas vagas e vou emboea
outros	Ainda temos vagas para entrar no grupo ...Alguém mas ta afim?só deixa o número ai ou me chama no whats: 19982310905  http://t.co/EbyWT7hxtq
outros	Boa noite Skater Girl!  As Inscrições para a categoria feminina estão rolando. Corre que as vagas são https://t.co/TUJUTKKxnh
outros	Representante Comercial - Mamatheka Creative Solutions -  São Paulo, SP http://t.co/j1GN9ID3K2 #vagas
outros	hoje terça temos um Super Satelite para o High Roller 10K Com 15 vagas garantidas  Inicio: 20h Buyin: https://t.co/V3eVBWdFWm
outros	Depois que eu olhei a quantidade de vagas eu só consigo pensar nelas, não consigo estudar
outros	Vendedora Externa - Autônoma - Ianúncios e-marketing -  São Paulo, SP http://t.co/zAurkuHLml #vagas
outros	Cluster Sales Director - Brazil - Maersk Line -  São Paulo, SP http://t.co/u8Qxckd4sw #vagas
outros	Indiquei 3 pessoas para vagas de emprego esse ano e as três foram contratadas
outros	Faça aulas de bateria com #GeraldoAbdo!!! Informações pelo e-mail geraldoabdo@gmail.com Vagas https://t.co/mjtk9LnHF0
outros	Bailarina e motociclista nas horas vagas http://t.co/73cJOhysnC
outros	7 pessoas pra 3 vagas na empresa, acho q fui bem na prova n sei, vamos ver hehehehehe
outros	Estagiário - Companhia de Saneamento Básico de São Paulo (Sabesp) -  Interior de São Paulo, SP http://t.co/K8ZzUkgzDI #vagas
outros	Ai rapá curte ai radiothehits. com web rádio é sucesso vagas abertas
outros	Oportunidades de segunda sempre interessantes... (mas vagas p/juiz federal do TRF1 caíram pra 155 - alô, @g1 !). https://t.co/TcOgy7z5QN
outros	Galera, ao enviar o e-mail de inscrição para as vagas da equipe t4, POR FAVOR COLOCAR O ASSUNTO, pois chega notificação do twitter também
outros	RT @aanalivia: O QUE VOCÊS ESTÃO ESPERANDO?! CORRAM PRA ADQUIRIR O INGRESSO!!! VAGAS LIMITADAS! http://t.co/7oY1Do16GB
outros	Galera voltamos com as aulas de Técnica Vocal via Skype e Presencial! Vagas limitadas!! Quem se https://t.co/w56YYFBNKb
outros	ALEM DE 6 AULAS VAGAS EU RECEBI A NOTÍCIA QUE VOU TER REPOSIÇÃO DE AULAS NAS FÉRIAS
outros	Tenho entrevista de emprego amanhã e to aqui ainda
outros	Escrevi um texto super explicativo pra marcar uma entrevista. Agora só orar pra pessoa aceitar.
outros	Me chamaram pra uma entrevista de emprego amanha  Dia.....      dia triste com certeza,,,,,
outros	@blognejo aguardando ansiosa pela entrevista e seus comentarios sobre a coletiva com Luan Santana!!!!!
outros	#Boanoite  Entrevista com mestre #Renatoateixeira  #MomentosFelizes  #CliqueEventos  #Cliquef5 https://t.co/y4kDP95mmJ
outros	Entrevista Sobre Traumatismo Craniano com @harianefonseca na NGTv #neurosurgeryblog @ Hospital https://t.co/qUuQAIGBps
outros	Tenho entrevista de emprego amanha, bem que eu podia ser contratado
outros	A korova me chamou para uma entrevista de emprego e eu acho que vou ser contratado
outros	Primeiro entrevista com Sorriso Maroto. Depois tocar o terror no palco e abrir o show dos pagodeiros https://t.co/22YPcXDUCM
outros	Acompanhem hoje às 18h45 no Opinião da Cidade a nossa entrevista referente à Audiência Pública que https://t.co/jcEdRiHuyQ
outros	Dando entrevista para o jornal #odia #riodejaneiro #riodejaneiroeuteamo #erijota @ Café e Bar Victor https://t.co/GU2svLOajw
outros	Amanha tenho uma segunda entrevista la no flamengo .. pqp
outros	#SamAlvesNoSemCensura Gente...entrevista esse DOCE que tá ai de touca @samalvesmusic
outros	Me ligaram pra fazer entrevista, tomara que de boa
outros	"E na Semana Maluca... lesapuca entrevista @xandedepilares. Estamos ao vivo com o ""Acústico FM O Dia""! https://t.co/vAqX2Q7sFx"
outros	John Cley é seleção,linda a entrevista dele
outros	@TeamNandoBBB só da margem pra falarem mal deles não entendi essa entrevista????
outros	AMANHA É A MINJA ENTREVISTA NO CRIARR SCRRRR
outros	Acordar as 6 da manha pra uma entrevista de emprego, quando chego la me dao um teste com pergunta mais random que enem e ainda me oferecem+
outros	Já acabou a entrevista kkkkkkk #BuyPrettyGilsOniTunes
outros	imagina se eu durmo na entrevista perco o emprego antes de começar
outros	E o Thiaguinho da entrevista após o jogo, cansado, mas agradecendo a oportunidade do professor e mais os 3 pontos conquistados na partida!
outros	Acho quase de certeza que vou aparecer na RIC amanhã ,um tanto quanto alterada .Aconselho não assistirem . Até o pai deu entrevista hahaha
outros	eu não quero entrevista, eu quero música. @MTVBrasil #TomorrowlandNaMTV
outros	Entrevista com homem bomba: - onde o senhor acha que vai quando morrer?   - se der certo pra todos os lados
outros	Meu domingo não podia terminar melhor depois dessa entrevista do Dado falando da Legião
outros	Após derrota, jornalista Bruna Martinez entrevista o jogador Alessandro. https://t.co/dGVSC5vivr
outros	Sobre o lançamento do CD #Perserveranca no barra_music, do @xandedepilares. Entrevista pra galera do https://t.co/RC91lolCMn
outros	Olha essa entrevista do Ricardo Oliveira. Cê e loco , deitou nas palavras
outros	Ontem eu assistido a entrevista da Dani no programa do Kibe e ela chega bem na hora do: masturbam vendo a Miney/Princesas não fazem boquete
outros	Salve rapaziada.. Daqui a pouco entrevista da #RaizVital no programa #piraocatarina da rádio #Univali https://t.co/rvVSKANXCK
outros	Na entrevista com o Cristiano Araújo, Eliana nao largou o prato um segundo claramente eu na vida
outros	Fiquei os ultimos vinte minutos, bolando um pedaco do texto da entrevista
outros	Que entrevista incrível na GNews, que loucura esse homem com 73 anos
outros	Entrevista sobre Crossfit à RPTV, afiliada Rede Globo em São Carlos, marcelleknittel e @kleincarlos https://t.co/aO5D83lahv
outros	Amostra a entrevista com o Kaka logo @eespetacular
outros	Ontem me chamaram para dar entrevista sobre a zona mista. Por favor né gente, não!
outros	Meus parabéns ao @faridgermano pela entrevista com Muricy Ramalho.
outros	E cá estamos de novo!! Rss Hoje pra curtir!! Entrevista muito legal pra Phouse! Bora conhecer as https://t.co/M5Xs4tocQr
outros	tava vendo a entrevista do Luan Santana e fiquei com vontade de comer bolo de chocolate
outros	Uma pequena prévia da entrevista com Fábio Jr onde, Donana foi a grande estrela!!! @fabiojr_real https://t.co/NGPkhPsQVs
outros	Gurias da Família Forsin, prontas pra entrevista.  | 01.05.15 - Soberana das Piscinas RS| https://t.co/MAL894bwgx
outros	Banda E.N.D na área  Entrevista para a TopTV Piraju  Photo of the Day!!  #photooftheday #photo https://t.co/LGvzqeyKL1
outros	Pronta pra entrevista e pro início do desfile.   | 01.05.15 - Soberana das Piscinas RS| https://t.co/TuBTfrc4ss
outros	Candidatas Juvenil e Adulta prontas pra entrevista.  | 01.05.15 - Soberana das Piscinas RS| https://t.co/ubYec9BFjZ
outros	Tava vendo uma entrevista aq do Oliver que so por Deus irmão kkk
outros	É sério isso!? Afe @ESPNagora: Ronaldinho Gaúcho pede salário de R$ 1,4 milhão para fechar com o #Cruzeiro; VEJA: http://t.co/Rt7YIPzSMR
outros	@RonaldoEsteves2 @FimDaGlobo Com certeza. Não recebemos salário. #DilmaDoTrabalhador
outros	@dilmabr destaca o aumento do salário mínimo e esquece da inflação que corrói o mesmo salario. #calabocaDilma
outros	Quanto o protesto era pedindo intervenção militar tinha paz e selfie com policial, agora quando é ajuste de salário tem porrada
outros	Interesse em se tatuar ou fazer um orçamento telefone para contato 997106989 @ Tatuaria Love https://t.co/OC1c6FQBE3
outros	Novos Pacotes de Casamento - Venha fazer seu orçamento sem compromisso e conhecer toda elegância de https://t.co/RwrWgeq09Z
outros	Em andamento interesse em se tatuar ou fazer um orçamento telefone para contato 997106989 @ Tatuaria https://t.co/Jk1tp7ZKM7
outros	Secretaria de Cultura terá orçamento de R$ 13 milhões
outros	Revisão de textos: o preço e o custo  solicite orçamento: A revisão do texto de uma tese ou dissertação tem c... http://t.co/vSPmR9bFs7
outros	@Dudu_Careca Contas totais do clube, não rubricas individuais. Somente se exceder 10% do orçamento um gasto/alienação único passará pelo CD.
outros	@Dudu_Careca Valor não é irrisório (perto de 100 mil reais) e, como és sabedor, orçamento e não gastos passam pela minha conivência no CD.
outros	Bom dia amigos e clientes trabalho em Em andamento interesse em se tatuar ou fazer um orçamento https://t.co/I4fSmNanRY
outros	Achei umas tatuagens muito top do jeito que eu curto amanha vou fazer um orçamento com o doco
outros	Universidade do Estado do Rio de Janeiro.  Quase 40% do orçamento cortado.  #pátriaeducadora https://t.co/py9nSClrik
outros	Traga seu equipamento e solicite orçamento gratuito, sem compromisso. @ UTI Do Celular https://t.co/gYZa2ZLj2o
outros	Aloha família! Encomende ja o seu carrinho com a NOVE! Orçamento sem compromisso! Whats 99126-9682! https://t.co/8vDCEJJCPl
outros	Peça ja seu orçamento sem compromisso!! - Instalação e Manutenção de Ar Condicionado - Instalação e https://t.co/tD2u4fgcpb
outros	Chorando pro meu cunhado abaixar um pouco o orçamento da minha obra, mas tá brabo, o pedreiro é caro rs
outros	Daqui a pouco vou colar em um estúdio, fazer um orçamento pra gente gravar nossa primeira música. Que tudo dê bom! #GoLiberttarius
outros	Assistência técnica especializada em toda linha Apple. Solicite um orçamento!!! # # # #iPhone https://t.co/dwrxXj1Xpc
outros	Eu já tinha vontade de fazer tatuagem aí minha prima me leva pra fazer o orçamento da dela
outros	Espero q amanhã a Amanda leve os modelos dos moletom, e agente ja escolha a cor pra segunda so passa pro sor e fazer o orçamento
outros	#participação #orçamento #PMSP #CPOP #Padilha @ Câmara Municipal de São Paulo https://t.co/pc2qyk1dGx
outros	Bom dia! Faça já seu orçamento pelo site (Link na bio) #Engenharia #Saneamento #Fossas @ Torri https://t.co/y2DIuwKaa9
outros	Aliás, gastaram uma fortuna do orçamento de marketing do Governo para criar a marca Petrobrax com uma agência amiga. https://t.co/J8SsYSSbEt
outros	Heynckes perdeu duas Bundesligas pro Borussia do Klopp gozando de um orçamento maior e um elenco mais pomposo. Isso todo mundo esquece tb.
outros	Aqui em cwb tem um lugar que faz plush personalizadas, pedi um orçamento de um do exo, vamos ver quanto sai
outros	Porta da esperança @ Secretaria da Justiça e da Defesa da Cidadania do Estado de São Paulo https://t.co/00H4m3TcS3
outros	@Estadao: SP: Justiça volta a proibir que professores divulguem greve nas escolas http://t.co/IQJXakPbVW
outros	Justiça daqui, humilhação dali e o Brasa continua indo pra vala
outros	Em sigilo de justiça, quer saber quem quebra o sigilo? É sigilo.
outros	Justiça gratuita para pessoa jurídica é um dos novos temas da Pesquisa Pronta http://t.co/884XuN3YZp
outros	 (@ Tribunal de Justiça do Distrito Federal e dos Territórios (TJDFT) - @tjdft_noticias in Brasília, DF) https://t.co/RqwZBVzjqr
outros	Observando a paisagem... #PhotoGrid @ Tribunal de Justiça do Estado de Rondônia https://t.co/FdNRiERIPC
outros	Boa tarde! @ Tribunal de Justiça do Estado de Rondônia https://t.co/VYglGdKRwE
outros	PAZ, JUSTIÇA E LIBERDADE para os que se encontram trancados
outros	10.474.462 pessoas poderiam ter olhado o 'Justiça Eleitoral' entre a sua 1ª menção até o momento que tornou-se uma Tendência. #trndnl
outros	738 usuários e 826 tweets (499 RTs) em 1 semana fez 'Justiça Eleitoral' um Trending Topic em Brasil. #trndnl
outros	@novoeleitoral a primeira menção ao 'Justiça Eleitoral' aparece na sua TL. Agora é Trending Topic na  Brasil! #trndnl
outros	'Justiça Eleitoral' encontra-se neste momento como Assunto do Momento (8). Mais tendências http://t.co/MffVmqH2oJ http://t.co/AzVwhbR7gM
outros	O #FreiLeonardoBoff na @TvBrasil programa #EspaçoPúblico solta os cachorros no juiz Moro e na Justiça no Brasil. #lavajato
outros	Enfim ... Que a justiça seja feita . O que tiver que ser será .Agora voltar pra Floripa que amanhã começa tudo de novo .
outros	@surfista7878 @realcris_silva Direção e Conselho não são policia ou Justiça. Sequer há fiscalização das penas do Judiciário!!
outros	Parabéns, colorados!!! Com justiça e merecimento, o Inter é Penta Campeão Gaúcho.  @ Gigante da https://t.co/iV8ZsoGYkI
outros	Excelente artigo do Celso Ming hoje no @Estadao sobre a decisão da justiça de brigar com a inovação e banir o Uber em São Paulo.
outros	Em reunião na Penitenciária Estadual de Aruanã com Dr. Adriano, diretor da unidade e Dra. Nubia, da secretária de estado e justiça de PV-RO
outros	@aleiarodrigues é foda. Justiça e prisão é para os pobres. 8 dos 11 juízes do STF são do PT.
outros	Livra-me dos crimes de sangue, ó Deus, Deus da minha salvação, e a minha língua louvará altamente a tua justiça. Salmos 51:14
outros	Precisamos combater a politização da justiça no Brasil. É um absurdo o que este ministero publico está fazendo.
outros	@OGlobo_Economia: Justiça do Rio manda q operadoras de telefonia parem d bloquear internet p/cel após fim da franquia http://t.co/leV1fl96vC
outros	Você decide punir Jon Jones por uma ação na Justiça de Albuquerque que não tem nada a ver com as lutas que acontecem em Nevada.  -Sonnen
outros	Se a Comissão Atlética de Nevada e a Justiça dizem que Jones pode lutar, deixem- no lutar!
outros	Um lugar que tenha paz, amor, justiça e nada mais  @ Três Pontas MG - A Nossa Cidade https://t.co/mwoE0OxK9P
outros	Siniav: Prazo para chip automotivo está bem próximo - Rastreador é barrado pela justiça http://t.co/zEYB2j60U3
outros	Palácio da Justiça - SP. Inexplicável a sensação de conhecer este lugar incrível e maravilhoso. https://t.co/WILaResHl0
outros	#OkOk  A Justiça tem q ser provida de lógica, mas tbm de alma, coraçao - mais humana... #Babilônia
outros	#OkOk  A imagem da Justiça - olhos  vendados, espada e uma balança - é dura e inflexível ! Mas em Babilônia...
outros	Vc que defende o PT, me conte como é defender um gov qUE precisa da intervenção da justiça pra garantir direitos estudantis. #CalaBocaDilma
outros	@Je_twittes @turquim5 Sempre o mesmo senso de justiça. Peculiar, aplica-se só ao PT. #meDigaMoroPorqueSoPT
outros	@_camilaline ta tendo o julgamento ora ver quem vai ter a guarda dela, aí o Lobao mostrou fotos do Gael c/ ela, desrespeitando a justiça
outros	"Refrigere minha alma e guia-me pelo caminho da justiça Salmo 23 cap. 3"" #tattoo #RacionaisMCs https://t.co/PJHUYhX5KQ"
outros	Seminário 30/04 - Feminicídio no Brasil: diagnóstico, desafios e perspectivas. @ Palácio Da Justiça - https://t.co/OmHxCzWpWQ
outros	Visitinha de uma oficial de justiça, ta boa viu. Era só o que me... Vou nem falar isso kkk
outros	Uma pergunta. Quanto custa a máquina judiciária no Brasil que ao invés de fazer justiça,  se meteram a fazer política.
outros	"TA DE SACA""@Netvasco: Justiça bloqueia cotas de TV e premiações do Vasco por causa de dívida com Márcio Careca http://t.co/AcCeuzfxYW"""
outros	Os cria do bagulho sempre pede na humildade pra todos os irmão paz , justiça e liberdade ...
outros	@OGloboPolitica: Justiça de São Paulo manda PT deixa de usar 'Coração Valente' de Dilma http://t.co/J5PUjsQwIV Valente??? E COVARDE!!
outros	@requiaopmdb Senador, Sinjuspar, servidores da justiça federal e eu aguardamos um horário com o senhor em Curitiba. Grata, felicidades, Nine
outros	Estágio Remunerado em Design Gráfico (Matutino) - Sesc Santa Catarina -  Florianópolis, SC http://t.co/amLOGLKOLj
outros	Vejo o pessoal que faz estágio na clínica de fisio trabalhando , e da uma vontade desses cinco anos passarem logo
outros	Como é difícil e triste ao mesmo tempo pedir dispensa do estagio no escritório aqui...  Me segurei para não chorar .. :'(
outros	Começando plantão do estágio mais esperado da facull  babys  (@ Hospital Santo Ângelo in Santo Ângelo, RS) https://t.co/fmLdZVdOKm
outros	Já com saudades do meu 1° dia de estagio em um hospital! Como esta passando rapido.. Formatura cada https://t.co/yhHwk6n46y
outros	Estágio de Geriatria e Gerontologia! Foi divertido hahaha #AnaCantaMuito #Dinâmica #Fisioterapia  @ https://t.co/PGkwKlZHYR
outros	Sobre meu estágio.... Papeis e mais papeis pra separar e analisar! #inss #estagio https://t.co/GqoAjuQauS
outros	Uma tese e um relatório d estágio p desenvolver e eu aq como se n tivesse nd p fazer
outros	Nunca pensei que fosse gostar tanto do estagio no bloco cirurgico. .
outros	"RT @rob_dcruz: ""sugiro pensar, em fazer um estágio na área que mais lhe agrada e aprender para empreender mais tarde em um negócio"" Cae Car"
outros	Pra me despedir do estágio na Delegacia... Um bolo com muuuuito chocolate.Até que ficou bonito https://t.co/CnmCovD3mH
outros	Concluindo mais um estágio! Fisio Traumato Ortopédica  #fisioterapiacomamor #lovefisio #instafisio https://t.co/LzHwAoowL9
outros	sugiro pensar, em fazer um estágio na área que mais lhe agrada e aprender para empreender mais tarde em um negócio Cae Caraccio #MPnoViber
